{"attempt_id":"0199a213-0000-7000-8000-000000000010","binding_digest":"","contract_version":"1.0.0","created_at":"2026-08-28T09:00:03.000000000Z","phase":"prepared","previous_transition_digest":"","projection_digest":"sha256:7a6618f956d3b97ef62ce079ec7ed0629ac57cfa3097d3f35d06e61bdab8ea16","provider_attempt":1,"provider_route":"ollama.local","request_id":"0199a213-0000-7000-8000-000000000009","revision":1,"run_id":"0199a213-0000-7000-8000-000000000006","schema_version":"coh.model-surface-transition/v1","scope":{"case_id":"0199a213-0000-7000-8000-000000000003","organization_id":"0199a213-0000-7000-8000-000000000001","task_id":"0199a213-0000-7000-8000-000000000004","tenant_id":"0199a213-0000-7000-8000-000000000002"},"stream_cursor":0,"terminal_outcome":"","transition_digest":"sha256:d517e88d53c4c3e583cd9029f4ebc38889f4f15d77cb97ba7f82a241395bccbe","transition_id":"0199a213-0000-7000-8000-000000000017","updated_at":"2026-08-28T09:00:03.000000000Z"}
